{
  "applicationRef": "approver:APPLICATION:apr-p3-fluxion-0001",
  "projectRef": "fluxion:PROJECT:11111111-1111-1111-1111-111111111111",
  "status": "APPROVED",
  "workflowRef": { "workflowId": "project-11111111", "runId": "run-p3-0001" },
  "proposalHash": "sha256:aaaaaaaaaaaaaaaaaaaaaaaaaaaaaaaaaaaaaaaaaaaaaaaaaaaaaaaaaaaaaaaa",
  "dispatchGeneration": 3,
  "decisionVersion": 1,
  "freshness": {
    "sourceEventId": "apr-result-p3-fluxion-0001",
    "sourceVersion": 1,
    "observedAt": "2026-09-19T00:00:00Z"
  },
  "updatedAt": "2026-09-19T00:00:00Z",
  "version": 1
}
